<?xml version="1.0"?>
<!--

    Copyright 2008-2017 Qualogy Solutions B.V.

    Licensed under the Apache License, Version 2.0 (the "License");
    you may not use this file except in compliance with the License.
    You may obtain a copy of the License at

    	http://www.apache.org/licenses/LICENSE-2.0

    Unless required by applicable law or agreed to in writing, software
    distributed under the License is distributed on an "AS IS" BASIS,
    WITHOUT WARRANTIES OR CONDITIONS OF ANY KIND, either express or implied.
    See the License for the specific language governing permissions and
    limitations under the License.

-->
<statements xmlns="http://qafe.com/schema" xmlns:xsi="http://www.w3.org/2001/XMLSchema-instance" xsi:schemaLocation="http://qafe.com/schema http://www.qafe.com/schema/application-statements.xsd">
	
	<!-- <insert sql="into users (id, name, birthdate) values('0', 'A', '18-08-1978')"/>
	<insert id="testInsertWithQuestionmarks" sql="into users (id, name, birthdate) values(?,?,?)"/> 
	-->
	<batch id="setup">
		<query sql="delete from QAFE_TEST_DELETE"></query>
	</batch>
	<batch id="teardown">
		<query sql="delete from QAFE_TEST_DELETE"></query>		
	</batch>
	<batch id="insertTestDataSet1">
		<query sql="insert into QAFE_TEST_DELETE(EMP_ID,EMP_NAME,DEP_ID) values('E1','E1Name','D1') "></query>
		<query sql="insert into QAFE_TEST_DELETE(EMP_ID,EMP_NAME,DEP_ID) values('E2','E2Name','D1') "></query>
		<query sql="insert into QAFE_TEST_DELETE(EMP_ID,EMP_NAME,DEP_ID) values('E3','E3Name','D2') "></query>
	</batch>
	<batch id="insertTestDataSet2">
		<query sql="insert into QAFE_TEST_DELETE(EMP_ID,EMP_NAME,DEP_ID) values('E1','E1Name','D1') "></query>
		<query sql="insert into QAFE_TEST_DELETE(EMP_ID,EMP_NAME,DEP_ID) values('E2','E2Name','D1') "></query>
	</batch>
			
	<delete id="testDeletePassingTableNameOnly" table="QAFE_TEST_DELETE"/>
	<delete id="testDeletePassingWrongTableName" table="NOT_EXISTING_TABLE"/>
	<delete id="deleteWithWhere" table="QAFE_TEST_DELETE" where="dep_Id=:dep_Id"/> 
	<delete id="deleteWithWhereAndSQLAttribute" sql="delete from QAFE_TEST_DELETE" where="dep_Id=:dep_Id"/>
	
	
	<query id="getData" sql="select EMP_ID,EMP_NAME,DEP_ID from QAFE_TEST_DELETE"/>
	
</statements>