<?xml version="1.0"?>
<!--

    Copyright 2008-2017 Qualogy Solutions B.V.

    Licensed under the Apache License, Version 2.0 (the "License");
    you may not use this file except in compliance with the License.
    You may obtain a copy of the License at

    	http://www.apache.org/licenses/LICENSE-2.0

    Unless required by applicable law or agreed to in writing, software
    distributed under the License is distributed on an "AS IS" BASIS,
    WITHOUT WARRANTIES OR CONDITIONS OF ANY KIND, either express or implied.
    See the License for the specific language governing permissions and
    limitations under the License.

-->
<statements xmlns="http://qafe.com/schema" xmlns:xsi="http://www.w3.org/2001/XMLSchema-instance" xsi:schemaLocation="http://qafe.com/schema http://www.qafe.com/schema/application-statements.xsd">
	
	<batch id="setup">
		<query sql="delete from QAFE_TEST_INSERT"></query>
	</batch>
	<batch id="teardown">
		<query sql="delete from QAFE_TEST_INSERT"></query>		
	</batch>
	
	<query id="getData" sql="select EMP_ID,EMP_NAME,DEP_ID,SALARY,ENTRY_DATE from QAFE_TEST_INSERT"/>
		
	<insert id="testInsertPassingTableNameWithInputsFormService" table="QAFE_TEST_INSERT"></insert>
 	<insert id="testInsertPassingSqlAttributeWithInputsFormService" sql="insert into QAFE_TEST_INSERT(EMP_ID,EMP_NAME,DEP_ID,SALARY,ENTRY_DATE) values(:EMP_ID,:EMP_NAME,:DEP_ID,:SALARY,:ENTRY_DATE)"></insert>
 	<insert id="testInsertPassingSqlAsTextWithInputsFormService">insert into QAFE_TEST_INSERT(EMP_ID,EMP_NAME,DEP_ID,SALARY,ENTRY_DATE) values(:EMP_ID,:EMP_NAME,:DEP_ID,:SALARY,:ENTRY_DATE)</insert>
 	<insert id="testInsertPassingCDataSqlAsTextWithInputsFormService"><![CDATA[insert into QAFE_TEST_INSERT(EMP_ID,EMP_NAME,DEP_ID,SALARY,ENTRY_DATE) values(:EMP_ID,:EMP_NAME,:DEP_ID,:SALARY,:ENTRY_DATE)]]></insert>
 
</statements>