<?xml version="1.0"?>
<!--

    Copyright 2008-2017 Qualogy Solutions B.V.

    Licensed under the Apache License, Version 2.0 (the "License");
    you may not use this file except in compliance with the License.
    You may obtain a copy of the License at

    	http://www.apache.org/licenses/LICENSE-2.0

    Unless required by applicable law or agreed to in writing, software
    distributed under the License is distributed on an "AS IS" BASIS,
    WITHOUT WARRANTIES OR CONDITIONS OF ANY KIND, either express or implied.
    See the License for the specific language governing permissions and
    limitations under the License.

-->
<statements xmlns="http://qafe.com/schema" xmlns:xsi="http://www.w3.org/2001/XMLSchema-instance" xsi:schemaLocation="http://qafe.com/schema http://www.qafe.com/schema/application-statements.xsd">
	<batch id="setup">
		<query sql="create table users (id VARCHAR, name VARCHAR)"/><!-- other type -->
		<query sql="ALTER TABLE users ADD CONSTRAINT PK PRIMARY KEY (id)"/><!-- other type -->
		<insert sql="insert into users (id, name) values('1', 'marc')"/>
	</batch>
	<batch id="teardown">
		<query sql="drop table users"/>
	</batch>
	<select id="select_all" sql="select * from users"/>	

	<insert id="insert_user" sql="insert into users (id, name) values(:id, :name)"/>

	<insert id="insertuseralreadyexists" sql="insert into users (id, name) values('1', 'marc')"/>
	
	<select id="testSelectSQLAsAttribute" sql="select * from users where id=:id "/>
	
	<select id="testSelectSQLAsText">
		select * from users where id=:id
	</select>
	<select id="testSelectSQLAsTextUseIn">
		select * from users
	</select>
	<select id="testSelectSQLAsTextUseOut">
		select * from users where id=:id
	</select>
	<select id="testSelectSQLAsTextUseInAndOut">
		select * from users
	</select>
	<select id="testSelectSQLUseInAndOutAndTableName" table="users"/>
</statements>