<?xml version="1.0" encoding="UTF-8" standalone="yes"?>
<!--

    Copyright 2008-2017 Qualogy Solutions B.V.

    Licensed under the Apache License, Version 2.0 (the "License");
    you may not use this file except in compliance with the License.
    You may obtain a copy of the License at

    	http://www.apache.org/licenses/LICENSE-2.0

    Unless required by applicable law or agreed to in writing, software
    distributed under the License is distributed on an "AS IS" BASIS,
    WITHOUT WARRANTIES OR CONDITIONS OF ANY KIND, either express or implied.
    See the License for the specific language governing permissions and
    limitations under the License.

-->
<statements xmlns="http://qafe.com/schema" xmlns:xsi="http://www.w3.org/2001/XMLSchema-instance"
	xsi:schemaLocation="http://qafe.com/schema http://www.qafe.com/schema/application-statements.xsd">
	
	
	<call id="callWithObjectOutput" sql="{call QAFE_COMPLEX_DATA.GetValuesObj(?)}" ></call>
	<call id="callWithObjectInput" sql="{call QAFE_COMPLEX_DATA.PutValuesObj(?,?)}" ></call>
	
	
	<call id="getFuncHello" call-name="qpd_fnc_get_hello" ></call>
	
	<call id="getFuncName" call-name="qpd_fnc_get_ename" ></call>
	<call id="getProcName" call-name="qpd_prc_get_ename" ></call>
	
	<call id="getFuncNameBySQL" sql="{? = call qpd_fnc_get_ename(?)}" ></call>
	<call id="getProcNameBySQL" sql="{call qpd_prc_get_ename(?,?)}" ></call>
	
	<call id="getPackFuncName" call-name="QPD_TEST_PCK.get_ename_fnc" ></call>
	<call id="getPackProcName" call-name="QPD_TEST_PCK.get_ename_prc" ></call>
	
	<call id="getPackFuncNameBySQL" sql="{? = call QPD_TEST_PCK.get_ename_fnc(?)}" ></call>
	<call id="getPackProcNameBySQL" sql="{call QPD_TEST_PCK.get_ename_prc(?,?)}" ></call>

 	<call id="getFuncNameBySQLAndNamedVars" sql="{? = call qpd_fnc_get_ename(:p_empno)}" ></call>
 	<call id="getProcNameBySQLAndNamedVars" sql="{call qpd_prc_get_ename(:p_empno,:p_ename)}" ></call>

	<call id="getPackFuncNameBySQLAndNamedVars" sql="{? = call QPD_TEST_PCK.get_ename_fnc(:p_empno)}" ></call>
	<call id="getPackProcNameBySQLAndNamedVars" sql="{call QPD_TEST_PCK.get_ename_prc(:p_empno,:p_ename)}" ></call>
	
	<call id="callSAY_HELLO_FNCOfQAFE_TESTS" sql="{? = call QAFE_TESTS.SAY_HELLO_FNC(:P_NAME)}"/>
	<call id="callSAY_HELLO_PRCOfQAFE_TESTS" sql="{call QAFE_TESTS.SAY_HELLO_PRC(:P_NAME,:P_RESULT)}"/>
	
	<!-- Calls in another schema -->
	<!-- In order to execute the call you need to do the following: grant EXECUTE on "QAFE"."QAFE_TESTS" to "HDEMO65"; -->
	<call id="callSAY_HELLO_FNCOfQAFE_TESTSOfAnotherSchema" sql="{? = call QAFE.QAFE_TESTS.SAY_HELLO_FNC(:P_NAME)}"/>
	<call id="callSAY_HELLO_PRCOfQAFE_TESTSOfAnotherSchema" sql="{call QAFE.QAFE_TESTS.SAY_HELLO_PRC(:P_NAME,:P_RESULT)}"/>
</statements>
